{
  "attrs": {
    "code.view": "blog.views.slow_transaction",
    "http.method": "GET",
    "http.path": "/slow-transaction/",
    "http.route": "/slow-transaction/",
    "http.status_code": 200,
    "process.runtime.name": "cpython",
    "process.runtime.version": "3.11.16",
    "service.name": "blog",
    "service.role": "web",
    "telemetry.sdk.language": "python",
    "tracepanel.framework": "Django 5.2.18"
  },
  "duration": 611210,
  "errors": [],
  "id": "01M4GPC55Y9KWYZTKWNR8AMWEH",
  "issues": [],
  "kind": "http",
  "links": [],
  "logs": [],
  "name": "GET /slow-transaction/",
  "spans": [
    {
      "attrs": {},
      "duration": 611210,
      "id": "01M4GPC55YT2BPAXBB9AWMNTT8",
      "kind": "http",
      "name": "GET /slow-transaction/",
      "parent_id": null,
      "start": 1791561700542051,
      "status": "ok"
    },
    {
      "attrs": {
        "code.view": "blog.views.slow_transaction"
      },
      "duration": 610706,
      "id": "01M4GPC55YS1KB45Y80SDSCT41",
      "kind": "view",
      "name": "blog.views.slow_transaction",
      "parent_id": "01M4GPC55YT2BPAXBB9AWMNTT8",
      "start": 1791561700542279,
      "status": "ok"
    },
    {
      "attrs": {
        "code.origin": "blog/views.py:192 in slow_transaction",
        "db.alias": "default",
        "db.namespace": "db.sqlite3",
        "db.system": "sqlite",
        "db.transaction.durable": false,
        "db.transaction.outcome": "commit",
        "db.transaction.savepoint": false
      },
      "duration": 610259,
      "id": "01M4GPC55YE9DR4KEFCZRCJ3AH",
      "kind": "transaction",
      "name": "transaction default",
      "parent_id": "01M4GPC55YS1KB45Y80SDSCT41",
      "start": 1791561700542350,
      "status": "ok"
    },
    {
      "attrs": {
        "code.origin": "blog/views.py:192 in slow_transaction",
        "code.template": null,
        "db.alias": "default",
        "db.client": "django",
        "db.fingerprint": "BEGIN",
        "db.many": false,
        "db.namespace": "db.sqlite3",
        "db.params_hash": "dff88b217460",
        "db.statement": "BEGIN",
        "db.system": "sqlite",
        "db.vendor": "sqlite"
      },
      "duration": 598,
      "id": "01M4GPC55ZCJD4YA5AXZBKQ5EA",
      "kind": "sql",
      "name": "BEGIN",
      "parent_id": "01M4GPC55YE9DR4KEFCZRCJ3AH",
      "start": 1791561700543157,
      "status": "ok"
    },
    {
      "attrs": {
        "code.origin": "blog/views.py:193 in slow_transaction",
        "code.template": null,
        "db.alias": "default",
        "db.client": "django",
        "db.fingerprint": "UPDATE \"blog_post\" SET \"likes\" = (\"blog_post\".\"likes\" + %s) WHERE \"blog_post\".\"id\" = %s",
        "db.many": false,
        "db.namespace": "db.sqlite3",
        "db.params": [
          1,
          1
        ],
        "db.params_hash": "9fb47f2c301f",
        "db.statement": "UPDATE \"blog_post\" SET \"likes\" = (\"blog_post\".\"likes\" + %s) WHERE \"blog_post\".\"id\" = %s",
        "db.system": "sqlite",
        "db.vendor": "sqlite"
      },
      "duration": 452,
      "id": "01M4GPC560T2KGF6HWEJRDCZ4T",
      "kind": "sql",
      "name": "UPDATE blog_post",
      "parent_id": "01M4GPC55YE9DR4KEFCZRCJ3AH",
      "start": 1791561700544402,
      "status": "ok"
    }
  ],
  "start": 1791561700542051,
  "status": "ok"
}
